{
  "schema": "https://superyeti.example/schema/avatar-manifest-v1.schema.json",
  "version": "1.0.0",
  "generated_at": "2026-10-08T16:55:10Z",
  "snapshot_id": "vrmcat-v1-268feafacb44826d7b953020",
  "collections": [
    {
      "id": "eip155:1/erc721:0x6120991c423f3566753d3c6c91a5b50d7d2461b4",
      "name": "Allstarz PSX",
      "tier": "A",
      "identifiers": {
        "chain": "ethereum",
        "chain_id": "1",
        "contract": "0x6120991c423f3566753d3c6c91a5b50d7d2461b4",
        "opensea_slug": "allstarz-psx"
      },
      "resolution": {
        "strategy": "token_metadata",
        "metadata_url": {
          "template": "https://allstarz.world/api/metadata/{token_id}.json"
        },
        "vrm_pointer": {
          "json_pointer_candidates": [
            "/vrm_url",
            "/vrm",
            "/asset",
            "/animation_url",
            "/files/0/uri"
          ],
          "required_mime": [
            "model/gltf-binary",
            "model/vrm",
            "application/octet-stream"
          ]
        }
      },
      "license": {
        "use_scope": "unknown",
        "commercial_scope": "unknown",
        "credit": "unknown",
        "redistribute_original": false,
        "modify": false,
        "redistribute_modified": false,
        "corporate_use": false,
        "terminates_on_transfer": false,
        "hate_speech_termination": true
      }
    },
    {
      "id": "eip155:1/erc721:0xb67ff46dfde55ad2fe05881433e5687fd1000312",
      "name": "Boomboxheads V2",
      "tier": "A",
      "identifiers": {
        "chain": "ethereum",
        "chain_id": "1",
        "contract": "0xb67ff46dfde55ad2fe05881433e5687fd1000312",
        "opensea_slug": "boomboxheads-v2"
      },
      "resolution": {
        "strategy": "url_template",
        "template": "ipfs://bafybeibe4axqsukdfeuy4fnrtti4dko7ph3fopl6xkr3tsdyp3zhhl5eyu/{id}.vrm"
      },
      "license": {
        "use_scope": "everyone",
        "commercial_scope": "corporation",
        "credit": "unnecessary",
        "redistribute_original": true,
        "modify": true,
        "redistribute_modified": true,
        "corporate_use": true,
        "terminates_on_transfer": false,
        "hate_speech_termination": true
      }
    },
    {
      "id": "eip155:1/erc721:0x6b67b34dfded7cf3b32cab94045aa82da2cc4bd9",
      "name": "Chuddies",
      "tier": "A",
      "identifiers": {
        "chain": "ethereum",
        "chain_id": "1",
        "contract": "0x6b67b34dfded7cf3b32cab94045aa82da2cc4bd9",
        "opensea_slug": "chuddie"
      },
      "resolution": {
        "strategy": "token_metadata",
        "metadata_url": {
          "template": "https://ipfs.io/ipfs/bafybeiebycjasqhzuomax77otu7koswj5p4awgmw3hrgjk2vh4xiriv5a4/{token_id}/metadata.json"
        },
        "vrm_pointer": {
          "json_pointer_candidates": [
            "/vrm_url",
            "/vrm",
            "/asset",
            "/animation_url",
            "/files/0/uri"
          ],
          "required_mime": [
            "model/gltf-binary",
            "model/vrm",
            "application/octet-stream"
          ]
        }
      },
      "license": {
        "use_scope": "unknown",
        "commercial_scope": "unknown",
        "credit": "unknown",
        "redistribute_original": false,
        "modify": false,
        "redistribute_modified": false,
        "corporate_use": false,
        "terminates_on_transfer": false,
        "hate_speech_termination": true
      }
    },
    {
      "id": "eip155:1/erc721:0x892848074ddea461a15f337250da3ce55580ca85",
      "name": "CyberBrokers",
      "tier": "A",
      "identifiers": {
        "chain": "ethereum",
        "chain_id": "1",
        "contract": "0x892848074ddea461a15f337250da3ce55580ca85",
        "opensea_slug": "cyberbrokers"
      },
      "resolution": {
        "strategy": "token_metadata",
        "metadata_url": {
          "template": "https://m.cyberbrokers.com/eth/mech/{token_id}/metadata.json"
        },
        "vrm_pointer": {
          "json_pointer_candidates": [
            "/vrm_url",
            "/vrm",
            "/asset",
            "/animation_url",
            "/files/0/uri"
          ],
          "required_mime": [
            "model/gltf-binary",
            "model/vrm",
            "application/octet-stream"
          ]
        }
      },
      "license": {
        "use_scope": "explicitly_licensed",
        "commercial_scope": "personal_profit",
        "credit": "unknown",
        "redistribute_original": false,
        "modify": false,
        "redistribute_modified": false,
        "corporate_use": false,
        "terminates_on_transfer": false,
        "hate_speech_termination": true
      }
    },
    {
      "id": "eip155:1/erc721:0x76250e9269e3df7d5bdc6af42582a1b54bf5d24e",
      "name": "DEyes Legends by Coldie",
      "tier": "A",
      "identifiers": {
        "chain": "ethereum",
        "chain_id": "1",
        "contract": "0x76250e9269e3df7d5bdc6af42582a1b54bf5d24e",
        "opensea_slug": "coldie"
      },
      "resolution": {
        "strategy": "token_metadata",
        "metadata_url": {
          "template": "https://ipfs.io/ipfs/bafybeih5g36ula4wzw6dmoso6tbimzh2dbfurcqzvv5mbosl5jdjhkzkxu/{token_id}/metadata.json"
        },
        "vrm_pointer": {
          "json_pointer_candidates": [
            "/vrm_url",
            "/vrm",
            "/asset",
            "/animation_url",
            "/files/0/uri"
          ],
          "required_mime": [
            "model/gltf-binary",
            "model/vrm",
            "application/octet-stream"
          ]
        }
      },
      "license": {
        "use_scope": "unknown",
        "commercial_scope": "unknown",
        "credit": "unknown",
        "redistribute_original": false,
        "modify": false,
        "redistribute_modified": false,
        "corporate_use": false,
        "terminates_on_transfer": false,
        "hate_speech_termination": false
      }
    },
    {
      "id": "eip155:1/erc721:0xd47d8672e45a7204057baaa3622a3fa276d651e3",
      "name": "DickButtVerse",
      "tier": "A",
      "identifiers": {
        "chain": "ethereum",
        "chain_id": "1",
        "contract": "0xd47d8672e45a7204057baaa3622a3fa276d651e3",
        "opensea_slug": "dickbuttverse"
      },
      "resolution": {
        "strategy": "token_metadata",
        "metadata_url": {
          "template": "https://dickbuttverse.sfo3.digitaloceanspaces.com/json/{token_id}.json"
        },
        "vrm_pointer": {
          "json_pointer_candidates": [
            "/vrm_url",
            "/vrm",
            "/asset",
            "/animation_url",
            "/files/0/uri"
          ],
          "required_mime": [
            "model/gltf-binary",
            "model/vrm",
            "application/octet-stream"
          ]
        }
      },
      "license": {
        "use_scope": "unknown",
        "commercial_scope": "none",
        "credit": "unknown",
        "redistribute_original": false,
        "modify": false,
        "redistribute_modified": false,
        "corporate_use": false,
        "terminates_on_transfer": false,
        "hate_speech_termination": false
      }
    },
    {
      "id": "eip155:1/erc721:0x31d4da52c12542ac3d6aadba5ed26a3a563a86dc",
      "name": "Fly Frogs",
      "tier": "A",
      "identifiers": {
        "chain": "ethereum",
        "chain_id": "1",
        "contract": "0x31d4da52c12542ac3d6aadba5ed26a3a563a86dc",
        "opensea_slug": "fly-frogs"
      },
      "resolution": {
        "strategy": "token_metadata",
        "metadata_url": {
          "template": "https://ipfs.io/ipfs/QmRdNB3Q6Q5gVWnduBmxNZb4p9zKFmM3Qx3tohBb8B2KRK/{token_id}/metadata.json"
        },
        "vrm_pointer": {
          "json_pointer_candidates": [
            "/vrm_url",
            "/vrm",
            "/asset",
            "/animation_url",
            "/files/0/uri"
          ],
          "required_mime": [
            "model/gltf-binary",
            "model/vrm",
            "application/octet-stream"
          ]
        }
      },
      "license": {
        "use_scope": "unknown",
        "commercial_scope": "unknown",
        "credit": "unknown",
        "redistribute_original": false,
        "modify": false,
        "redistribute_modified": false,
        "corporate_use": false,
        "terminates_on_transfer": false,
        "hate_speech_termination": true
      }
    },
    {
      "id": "eip155:1/erc721:0x521f9c7505005cfa19a8e5786a9c3c9c9f5e6f42",
      "name": "Forgotten Runes Wizards Cult",
      "tier": "A",
      "identifiers": {
        "chain": "ethereum",
        "chain_id": "1",
        "contract": "0x521f9c7505005cfa19a8e5786a9c3c9c9f5e6f42",
        "opensea_slug": "forgottenruneswizardscult"
      },
      "resolution": {
        "strategy": "url_template",
        "template": "nftz.forgottenrunes.com/dev/3d/wizards/{id}/wizard_{id}.vrm"
      },
      "license": {
        "use_scope": "explicitly_licensed",
        "commercial_scope": "unknown",
        "credit": "unknown",
        "redistribute_original": false,
        "modify": false,
        "redistribute_modified": false,
        "corporate_use": false,
        "terminates_on_transfer": false,
        "hate_speech_termination": true
      }
    },
    {
      "id": "eip155:1/erc721:0xbfd4f75a3c09c26e6ce9e67a257f6fbce9f63088",
      "name": "Frutiger Anons",
      "tier": "A",
      "identifiers": {
        "chain": "ethereum",
        "chain_id": "1",
        "contract": "0xbfd4f75a3c09c26e6ce9e67a257f6fbce9f63088",
        "opensea_slug": "frutiger-anons"
      },
      "resolution": {
        "strategy": "token_metadata",
        "metadata_url": {
          "template": "https://d1kgk9u8ytew77.cloudfront.net/ipfs/QmT64bM8LTCwtNGmj5mrh7V9oHmzKwwVyygTD1mjNqaGGX/{token_id}/metadata.json"
        },
        "vrm_pointer": {
          "json_pointer_candidates": [
            "/vrm_url",
            "/vrm",